{
  "schema_version": "1.0.0",
  "app_version": "0.3.0",
  "build_number": "42",
  "device_family": "iPad",
  "os_version": "26.5",
  "screen": "flashcard-review",
  "breadcrumbs": [
    {
      "timestamp": "2026-07-09T10:15:00Z",
      "event": "review_started",
      "metadata": { "deck_id_hash": "fictional-deck-7", "card_count": 12 }
    }
  ],
  "state_snapshot": { "route": "review", "selected_card_index": 3, "is_offline": false },
  "logs": [
    { "level": "error", "category": "review", "message": "save_failed domain=SampleStudy code=17" }
  ],
  "redactions": ["card_front", "card_back", "account_identifier"],
  "user_attached_files": [],
  "privacy_review": {
    "contains_user_content": false,
    "contains_tokens": false,
    "contains_screenshots": false
  }
}
